Name,url,keywords
Beverly Hills Chihuahua,https://www.imdb.com/title/tt1014775/,"chihuahua, three word title, slimehouse, animals family, canine, dognapping, kidnapping, rescue, fish out of water, bad guy, north america, mexico, dog fighting, dog, dog movie, german shepherd, tijuana mexico, potted plant, mexico city, chihuahua dog, train, police dog, pinata, talking dog, talking animal, animal in title, beverly hills california, animal, title spoken by character"
You Got Served,https://www.imdb.com/title/tt0365957/,"reference to 'nsync, dance movie, grammatical error in title, dream, group, bare midriff, african american, friend, competition, money, street dancing, dance contest, black, reference to queen, reference to britney spears, dance off, teen movie, teamwork, rap music, hip hop, breakdance"
Furry Vengeance,https://www.imdb.com/title/tt0492389/,"barefoot male, nightmare, close up of eyes, close up of lips, close up of mouth, slapstick comedy, two word title, slimehouse, nintendo wii, wii remote, playing wii, wii tennis, rorschach test, wii sport, dark comedy, 15 year old boy, 15 year old girl, dance party ending, moving house, family relationships, psychiatrist, rural setting, animals family, vulture, north america, real estate developer, real estate, animal, bear, land developer, raccoon, forest, animal in a cage, cage, environmentalism, festival, animal attack, portable toilet, nature, trap, suv, therapist, corporate jet, teacher, school, skunk, construction company, businessman, environmental issue"
Tubelight,https://www.imdb.com/title/tt5882970/,"brother brother relationship, dance, shoes, ice cream, vintage car, jump, battle, hope, faith, magician, bottle, nonviolence, uncle, little boy, india, hostage, phone number, departure, recruitment, army, boots, photograph, stone, catapult, soda, mental disability, photo studio, river, coffin, soldier, gunfight, bomb, sky, horse, classroom, earthquake, slap, priest, punch, force, innocent, cycle, mountain, rejection, 1960s"
The Survival of Humanity,https://www.imdb.com/title/tt1517489/,"child spy, machete cortez character, child thwarting a crime, strong female, female protagonist, the weinstein company, slimehouse, male antagonist, robot dog, xbox 360, xbox 360 controller, playing xbox 360, apple macintosh computer, vomiting, title directed by male, female pedal pumping, spy, female secret agent, breath holding contest, spying, james bond spoof, aromascope, sequel, secret agent, fourth part, espionage"
Dance Flick,https://www.imdb.com/title/tt1153706/,"reference to pubic hair, female flatulence, parody comedy, dance, african american, rap, parody, overalls, high school, urination, childbirth, wardrobe malfunction, teenager, teacher, teacher's pet, spoof, single mother, school, rapper, innuendo, hip hop, gay, gangsta, cross dressing, child abuse, breakdance, audition"
S. Darko,https://www.imdb.com/title/tt1231277/,"year 1995, friend, time travel, period in title, direct to video sequel to theatrical movie, small town, existentialism, sequel, second part, character name in title"
Singularity,https://www.imdb.com/title/tt7312940/,"robot, robot sci fi, artificial intelligence, artificial intelligence sci fi, psychotronic film, 2020s"
Judwaa 2,https://www.imdb.com/title/tt5456546/,"re make, twin brother, ganesh festival, brother brother reunion, posing as twin brother, sequel, sock, socks, man in socks, white socks, someone in socks, men's socks, male feet in socks, male socked feet, ragging, hazing, man forced to strip, forced to strip, male forced to strip, forced to stand, forced strip, stripped by force, force someone to undress"
Day of the Dead: Bloodline,https://www.imdb.com/title/tt3053228/,"post apocalypse, zombie, zombie apocalypse, bully comeuppance, sick child, underground bunker, grindhouse film, gore, intelligent zombie, stalker, scientist, vaccine, zombie horror, zombie pandemic, horror movie remake, remake, blood on camera lens, hospital, humvee, psychotronic film, five word title, graphic violence, rapist, military installation, female doctor, greenhouse, f word, profanity"
Larry the Cable Guy: Health Inspector,https://www.imdb.com/title/tt0462395/,"villainess, reference to pubic hair, city, restaurant, health inspector, food poisoning, undercover, diner, fired from a job, male female relationship, wheelchair, truck, toilet, syringe, sister sister relationship, shopping mall, scene during end credits, scatological humor, restroom, orlando florida, neighbor, mother daughter relationship, mental retardation, mayor, male nudity, interracial romance, flatulence, fake injury, dream sequence, disguise, contest, cockroach, breaking the fourth wall, bar, car theft, androgyny, character name in title"
Dumb and Dumberer: When Harry Met Lloyd,https://www.imdb.com/title/tt0329028/,"seven word title, punctuation in title, dream girl, crush, swimming pool, bathroom, covered in mud, twin sister, ferrari, best friend, younger version of character, parade, arrest, parade float, treasure chest, outtakes during end credits, red ferrari, scene during end credits, melted chocolate, childbirth, year 1969, police car, well, backyard, cassette tape, tape recording, handcuffs, handcuffed to a chair, bully, punk, interracial romance, janitor, father son relationship, mother son relationship, scene during opening credits, scene before opening credits, ketchup, dog, ice cream truck, looking in a window, car crash, telephone call, telephone booth, special needs child, school bus, special needs, special needs class, chased by a dog, rottweiler, chance meeting"
Feardotcom,https://www.imdb.com/title/tt0295254/,"bound and gagged, torture, snuff film, vengeful ghost, stabbed in the back, shot in the chest, hostage, falling from height, car crash, blindfold, scalpel, operating table, video camera, website, cockroach, internet, tied to a table, tied to a chair, hung by one's wrists, bondage gear, naked dead woman, kidnapping, evil doctor, pet cat, dead body in a bathtub, torture device, dead body in water, camera shot of a woman's bare feet, hand over mouth, gagged, suspended by arms, bound and blindfolded, camera shot of a woman's feet in high heels, neo noir, subway tunnel, hemophilia, website in title, writing in blood, thrown through a windshield, threatened with a knife, suicide, suffocation, stalking, stabbed in the neck, shot in the leg, severed arm, police station, police detective, pistol, nosebleed"
Recep Ivedik 5,https://www.imdb.com/title/tt6439558/,"skopje macedonia, north macedonia, skopje, turkey the country, athletic director, long jump, doping, bus, barbell, wrestling, olympic games"
365 Days,https://www.imdb.com/title/tt10886166/,"oral sex, sex scene, female star appears nude, abducted woman, female full frontal nudity, male nudity, sex on a boat, stockholm syndrome, female masturbation, oral sex on a plane, captive, doggystyle sex position, missionary position sex, cowgirl sex position, masturbation, female masturbation with a vibrator, female nudity, cunnilingus, male pubic hair, mafia boss, snorting cocaine, sex in a bathroom, softcore, boob drop, sex on boat deck, bikini, kidnapped woman, club, mafia, kidnapping, sexual assault, erotica, fellatio, male frontal nudity, in love with kidnapper, kidnapped love interest, pubic hair, penetration, sexual, abuse of power, female rear nudity, man obsessed with a woman, sicily, polish woman, nudity, stewardess, sexual harassment, mobster, criminal, italian mafia"
Jack and Jill,https://www.imdb.com/title/tt0810913/,"worst picture razzie winner, basketball court, pet hamster, scene during opening credits, thanksgiving, sneeze, twins, woman played by man, commercial, gender disguise, actor, cruise ship, date, actor playing himself, actor playing female role, twin brother and sister, elizabeth i character, tickling, character names as title, forenames as title, basketball, basketball ball, basketball game, basketball hoop, basketball player, basketball jersey, national basketball association, nba, spalding, los angeles lakers, sacramento kings, soccer, soccer ball, buick automobile, cadillac automobile, cadillac escalade, dodge the car, honda, honda civic sedan, nissan, toyota, hamster, slimehouse, reference to baby it's cold outside the song, male wearing shorts, buddy comedy, male actor playing a female character, advertising executive, advertising, co written by actor"
The Open House,https://www.imdb.com/title/tt7608028/,"mother son relationship, death of husband, open house, shower scene, unknown killer, death of father, grief, female rear nudity, nudity, photography, main characters killed off, basement, contact lenses, running, close up of eye, rustic setting, no opening credits, teenager, title directed by female, title co directed by female, pouring water on someone, stopwatch"
Hercules in New York,https://www.imdb.com/title/tt0065832/,"central park manhattan new york city, ship, empire state building manhattan new york city, chase, friendship, father son relationship, farce, professor, bodybuilder, lead actor's first film, bare chested male, gangster, mafia, airplane, bear, weightlifting, city name in title, fish out of water, new york city, independent film, character name in title, surprise ending, hercules character, zeus the greek deity, sailor, pretzel, lightning, zoo, mount olympus, hell, chariot, bodybuilding, brawl, muscleman, strongman, tough guy, wrestling, greek mythology, b movie, radio, hades the greek deity, crystal ball, falling into water, taxi driver, athlete, lifting someone into the air, immortality, drugged drink, helicopter, newspaper headline"
Far Cry,https://www.imdb.com/title/tt0400426/,"based on video game, murderess, murder, woman murders a man, man tied up, tied back to back, german exploitation, exploitation film, z movie, soldier, live action video game adaptation, live action adaptation, island, journalist, mercenary, military, boat, super soldier, neck breaking, woman's neck broken, shot in the eye, villainess, boat chase, humvee, gene manipulation, fight, reporter, human experiment, scientist, cult film, mad scientist, hand grenade, exploding helicopter, exploding car, exploding boat, tropical island, genetic experimentation, genetic engineering"
Captain America,https://www.imdb.com/title/tt0103923/,"president of the united states, conspiracy, femme fatale, nazi, fish out of water, super strength, world war two, hand to hand combat, action hero, frozen alive, shield, super soldier, based on comic book, superhero, year 1936, year 1943, year 1993, abduction, rome italy, newspaper reporter, washington d.c., the white house washington d.c., mutation, secret door, human experimentation, father daughter relationship, culture shock, motorcycle, fortress, car theft, dual role, incarceration, italy, alaska, california, terrorism, terrorist, terrorist plot, duel, martial arts, fistfight, masked man, female scientist, death of mother, rat, redondo beach california, secret entrance, rocket, hand over mouth, interwar period"
The NeverEnding Story III,https://www.imdb.com/title/tt0110647/,"sequel by name only, cult film, playing guitar, new kid in school, destruction, gnome, martial arts, fistfight, fireworks, high fantasy, slimehouse, magical book, metafiction, world, group, boy, book, bully, school library, sword and sorcery, third in trilogy, part of trilogy, talking rock, anger, numbered sequel, low budget film, flashback, librarian, hatred, hairdo, cynicism, magic, stepbrother stepsister relationship, wish, wish fulfillment, telescope, teenage boy, shopping mall, selfishness, puppet, karate, immaturity, high school, halloween, greed, good versus evil, fire, fear, explosion, evil plot"
The Starving Games,https://www.imdb.com/title/tt2403029/,"parody, bloopers during credits, comedic sex scene, superhero, girl farting, landmine, hilarious peak of comedy, teenage girl as protagonist, reference to avatar, parody of cult film, superhero sci fi, parody comedy, game, pickle, fight, spoof, gay, flatulence, cheerleader, baguette, torso cut in half, berries, arrow in the chest, human shield, finger bent backward, foot fetish, condom, 3d glasses, simulated sex, giant cake, nike swoosh, acne, rainbow, pinata, orange, woods, surveillance camera, glass eye, scar, instant replay, fireball, weed whacker, knapsack, body cut in half, gay stereotype, coward, outdoor toilet, defecation, foot in ass, catatonia"
Daddy Day Camp,https://www.imdb.com/title/tt0462244/,"child vomiting, summer camp, vomiting, toilet, sequel, second part, slimehouse, part of duology, day camp, revolution studios, african american, son, competition, mullet, tween girl, wall, skunk, estranged father, woods, cheating, family relationships, grandfather grandson relationship, father son relationship, colonel, rivalry, slapstick comedy"
Goal! III,https://www.imdb.com/title/tt0499487/,"soccer sport, world cup, soccer movie, wedding party, wedding ceremony, stadium, sports team, sports star, sports fan, split screen, speech, soccer, soccer stadium, soccer player, soccer match, soccer fan, soccer coach, photo shoot, penalty shootout, penalty kick, nightclub, marriage proposal, male bonding, loss of loved one, loss of friend, little girl, funeral, funeral wake, father daughter relationship, cgi, best man, archive footage, third part, sequel"
Left Behind,https://www.imdb.com/title/tt2467046/,"faith, product placement, disaster film, chaos, bible quote, shrine, obese man, breakdancing, riot, shower, church, hospital, apocalypse, prophecy, bible, aircraft cockpit, english, one day timespan, new york city, religious film, copilot, epilogue, muslim man, fuel leak, car, u.s. car, ford, ford motor vehicle, ford car, ford f 150, swedish car, saab, saab motor vehicle, saab 9 3, commercial air travel, cameo, convertible, dystopian sci fi, world, group, female pedal pumping, adultery, suburb, conspiracy theorist, abandoned house, wallet, southern accent, drug addict, alzheimer's disease, little person"
Kazaam,https://www.imdb.com/title/tt0116756/,"bathing, glass of water, rapping, wrecking ball, mother son relationship, bicycle, fight, nightclub, bully, spray paint, one against many, falling to death, basketball, rapper, father son reunion, brought back to life, music piracy, single mother, robbery, crime boss, divorce, product placement, truancy, skipping school, boom box, genie, one word title, wish fulfillment, hamburger, father son relationship, death of child, character name in title, title spoken by character, boy, warehouse, wish, magic, singer, firefighter, child kidnapping, falling from height, bed, ice cream, bodyguard, tutor, elevator shaft, junk food, toast, rescue, brawl"
Rollerball,https://www.imdb.com/title/tt0073631/,"dystopia, fictional sport, defiance, resentment, conspiracy, courage, hero, corporation, future, based on short story, sports team, corporate executive, tournament, fistfight, forced retirement, violence, title spoken by character, multinational corporation, ball, environmental destruction, husband wife relationship, cheering audience, coma, ex husband ex wife relationship, head injury, roller skates, chanting someone's name, motorcyclist, vegetative state, dysfunctional marriage, reminiscence, cynicism, athlete, fight, fighting the system, coach, hit by a motorcycle, retribution, brutality, murder, friendship, orchestral music score, pill, motorcycle accident, artificial intelligence, super computer, competition, helmet, training, blood splatter"
Bratz,https://www.imdb.com/title/tt0804452/,"teen protagonist, intentionally misspelled title, flash forward, female friendship, convertible, bumping into someone, soccer, cheerleading squad, video camera, alarm clock, fashionista, sign language, vibration, headphones, music teacher, blonde, interracial friendship, interracial relationship, piano playing, boyfriend girlfriend relationship, classroom, mean girl, pet dog, spaghetti, brunette, bust sculpture, throwing food, principal, bullying, cctv, memory stick, high school clique, facial, cell phone, shopping, african american, asian american, audition, contortionist, violin, popularity, makeup, applying makeup, nerd, jock, martial artist, fistfight, reference to myspace, hot tub, hit in the groin"
Jaws: The Revenge,https://www.imdb.com/title/tt0093300/,"shark, shark attack, 1980s, killer shark, animal monster, underwater scene, revenge, sea, christmas, death of brother, great white shark, funeral, sharksploitation, nipples visible through clothing, watercraft, submersible, horror icon, sequel, fourth part, lifting someone into the air, creature feature, shark feature, famous score, slow motion scene, male nudity, lifting a male into the air, lifting a female into the air, aviation, giant shark, family relationships, sequel to cult favorite, island, boat, woman killed by a shark, three word title, death of uncle, giant animal, death of fiance, caribbean sea, shark hunter, heart attack, vengeance, banana boat, human versus shark, husband wife relationship, mother son relationship, marine biologist, reference to norman rockwell, animal attack, begins with a dream"
Troll 2,https://www.imdb.com/title/tt0105643/,"corn, green fluid, mediocrity, inconsistency, sexual innuendo, person on fire, singing in a car, obscene finger gesture, talking while driving, second part, b movie, superficiality, green substance, dumbness, awkwardness, seduction, incoherence, electronic music score, urination, vegetarian, skateboard, sheriff, reverse footage, pudding, fire extinguisher, weightlifting, rocking chair, preacher, hit in the groin, boom box, unofficial sequel, goblin, troll, bad guys win, watching tv, sport utility vehicle, color, eccentricity, unintentional humor, child in jeopardy, man wears eyeglasses, woman wears eyeglasses, boy wears eyeglasses, the color green, violence, grindhouse film, horror b movie, midnight movie, surrealism, sequel by name only"
BloodRayne,https://www.imdb.com/title/tt0383222/,"medieval times, human vampire hybrid, collecting blood, breast licking, bare chested male, huntress, femme fatale, stylized violence, hybrid, female human vampire hybrid, character name as title, psychotronic film, 18th century, carnival flyer, no reflection, stabbed in the heart, dead body turns to dust, walking on stilts, scalded, cutting the skin, sheep, drinking blood, rapid healing, captivity, tortured for entertainment, cross on a mountain top, cross pendant, nightmare, bitten on the neck, neuschwanstein castle, hit with a bottle, impaled by a sword, disemboweled, covered wagon, horse drawn wagon, cremation, come here hand gesture, key, archer, close up of eye, throwing knife, pokies, female topless nudity, draining blood, suspended by arms, biting off someone's ear, immolation, burnt by sunlight, locked in a cell, seeing mother murdered"
Steel,https://www.imdb.com/title/tt0120207/,"african american, african american protagonist, good versus evil, one man army, action hero, vigilante, crime fighter, arms dealer, los angeles california, based on comic book, paraplegic, character name in title, one word title, grandmother grandson relationship, sledgehammer, ghetto, brother brother relationship, abduction, villain, uncle nephew relationship, gang, junkyard, military, soldier, female soldier, terrorist, explosion, reference to shaft, reference to superman, reference to james brown, reference to batman, tall man, one against many, hero, laser gun, train, police chase, crushed to death, gangster, basketball, shootout, tank, bank robbery, exploding helicopter, wheelchair, superhero, magnet, dc comics, black superhero, souffle"
3 Ninjas: High Noon at Mega Mountain,https://www.imdb.com/title/tt0118539/,"hostile takeover, machine gun, die hard scenario, disguised as a nun, ak 47, explosion, wrestler, birthday party, violence, child martial arts, ninja, ninja army, child in jeopardy, fbi federal bureau of investigation, slimehouse, villainess, close up of eyes, amusement park, wrestler as actor, birthday, 1990s, martial arts, training, female villain, ninjitsu, katana sword, sword fight, foot chase, fistfight, brawl, taser gun, terrorism, terrorist, tied up, brother brother relationship, night vision, flying kick, boyfriend girlfriend relationship, male female relationship, karate chop, hand to hand combat, tough girl, electric fence, m 16, fbi agent, ship, wrestling, martial artist, tough guy, action hero"
Winnie-the-Pooh: Blood and Honey,https://www.imdb.com/title/tt19623240/,"lesbian couple, stalker, pig, knife, mild female nudity, slasher horror, lesbian, honey, female nudity, slasher, british horror, bear, young man, young woman, blood, gore, bare chested male, cabin, woods, stabbed to death, hammer, hogtie, dungarees, denim shirt, flannel shirt, bloody violence, grindhouse film, slasher killer, slasher murderer, characters murdered one by one, characters killed one by one, voice over narration, gratuitous female nudity, f word, head crushed, winnie the pooh character, no ending, unhappy ending, female pedal pumping, villain not really dead cliche, monster horror, burning a corpse, hot tub, getting lost, eeyore character, rabbit character, hostage, corpse, college student, pickup truck"
Jiu Jitsu,https://www.imdb.com/title/tt9624766/,"based on comic, martial arts, martial artist, alien, alien invasion, psychotronic film, two word title, scene before opening credits, prologue, jiu jitsu, kung fu, fistfight, fight, brawl, mixed martial arts, hand to hand combat, punched in the face, punched in the chest, kicked in the face, kicked in the stomach, beating, beaten to death, head butt, fight to the death, showdown, final showdown, based on comic book, grindhouse film, b movie, woods, female martial artist, bilingualism, subtitled scene, translator, comic relief, opening action scene, one against many, two against one, murder, death, violence, mercilessness, held at gunpoint, rescue, escape, ambush, blood, blood splatter, burma, rainforest"
Breach,https://www.imdb.com/title/tt0401997/,"investigation, washington monument washington d.c., fbi federal bureau of investigation, cia central intelligence agency, true crime, nightgown, woman wears a nightgown, silk nightgown, agent, woman wears a silk nightgown, woman wears lingerie, lingerie, lingerie slip, sexy nightgown, nightie, counter espionage, 2000s, political thriller, spy thriller, clerk, computer, spy, catholic, task force, religious icon, code, secrecy, hacker, covert, arab, watching tv, tv news, target shooting, classified information, intrigue, video cassette, watching a porno movie, newsreel footage, handgun, church service, weapons deal, government, security, secret agent, government agent, corpse, dead body, lie detector, motion sensor, heat sensor"
Cats,https://www.imdb.com/title/tt5697572/,"dancing, singing, cat, female protagonist, based on stage musical, based on stage musical based on book, animal in title, love, friendship, rebirth, melodrama, ensemble cast, communicating through song, worst picture razzie winner, anthropomorphic cat, uncanny valley, surrealism, friend, outcast, fight, singer, actor, street, title sung by character, song, vignette, rescue, coming of age, dance, cockroach, 2010s, barge, river thames, anthropomorphic animal, cult film, based on poem, furry, one word title, title spoken by character, troubled production, entertainment, no title at beginning, no opening credits, title at the end, train track, reward poster, cat movie, based on poetry, pop musical, ensemble"
Meet the Spartans,https://www.imdb.com/title/tt1073498/,"george w. bush character, donald trump character, britney spears character, tom cruise character, battle of thermopylae, sparta, greece, persian empire, slapstick comedy, xerxes, persian, oracle, battle, traitor, penguin, cliff, homoeroticism, gay kiss, male male kiss, pixelated nudity, 5th century b.c., achaemenid empire, king, spartan, warrior, whip, competition, father son relationship, hand to hand combat, kiss, movie spoof, messenger, kicking, james bond spoof scene, falling off a cliff, captain, beard, transformer, celebrity, breakdance, ancient greece, american idol, scene during end credits, chastity belt, beefcake, spoof, male rear nudity, no opening credits, rocky balboa character, legs"
Date Movie,https://www.imdb.com/title/tt0466342/,"redheaded woman, trash movie, licking someone's face, frodo baggins character, michael jackson character, gandalf character, britney spears character, looking at oneself in a mirror, toilet, low brow, farce, superhero, reference to kill bill, blonde woman, nail gun, fight, woman wears a bikini, woman wears a wedding dress, cult film, z movie, b movie, low budget film, psychotronic film, unintentional humor, unintentionally funny, climbing out of a swimming pool, slow motion shot, jealous girlfriend, female rear nudity, side boob, horse and carriage, napoleon dynamite character, villainess, parody comedy, fat shaming, alvinophilia, romantic comedy, wedding planner, overweight, greek, spoof, fat suit, female protagonist, rodeo drive beverly hills, foot popping kiss, punched in the face, masturbation, falling down stairs, voice over narration, slow motion scene"
Tees Maar Khan,https://www.imdb.com/title/tt1572311/,"bound and gagged, child kidnapping, movie reality crossover, memory, forgetting a name, forgetfulness, remember, memory lapse, movie poster, mental illness, spine, snoring, caper crime, female director, female filmmaker, train, village, robbery, body, headless horseman, treasure, film star, f rated, popular song, title directed by female, gay marriage, albino, effeminacy, gay joke, gay stereotype, gay, eid, burqa, cbi officer, item song, antique smuggler, film shoot, film set, academy award, academy awards ceremony, parachute, film premiere, airhead, bimbo, sidekick, henchman, invisible man, invisibility, caper, secretary"
