Name,url,keywords
Police Academy 6: City Under Siege,https://www.imdb.com/title/tt0098105/,"police academy, sixth part, sequel, jewelry store robbery, 1980s, frame up, reference to siskel and ebert, ends with a freeze frame, crime wave, false accusation, police officer, police commissioner, police lieutenant, police sergeant, medal award ceremony, real estate scam, reference to pinocchio, poison gas, underground hideout, information leak, criminal mastermind, police precinct, manipulating a traffic signal, diamond theft, armored car robbery, sting operation, police chase, undercover operation, armed robbery, police stakeout, police captain"
Getaway,https://www.imdb.com/title/tt2167202/,"character repeats someone else's dialogue, kidnapped wife, former racing driver, telephone call, shelby mustang, skating rink, shopping mall, driving inside a shopping mall, running a red light, causing a car crash, attempted car jacking, chased by the police, bulgaria, ramming a car, emergency call, power station, armed robbery, high speed chase, video feed, airplane hangar, computer hard drive, bank heist, distraction, hostage exchange, carsploitation film, race against time, race car driver, villain escapes, gunfight, die hard scenario, title at the end, earth viewed from space, ipad, hit with a car door, shot to death, shot in the chest, murder, on the run, motorcycle crash, rain, american abroad, photograph, christmas party, reckless driving, park, no opening credits, zippo lighter, armored car, video camera, flashback"
Fantastic Four,https://www.imdb.com/title/tt0120667/,"lingerie slip, fantastic four, superhero action, masked man, flying, origin of hero, elasticity, blind woman, new york city, brother sister relationship, marriage proposal, crushed car, superhero, superhero team, invisibility, based on comic book, 2000s, rock creature, burger king, undressing, title appears in writing, based on comic, title spoken by character, first part, supernatural power, sue storm character, invisible woman the marvel comics character, reed richards character, mister fantastic character, the thing the marvel comics character, ben grimm character, johnny storm character, human torch character, doctor doom character, stan lee cameo, mutation, good versus evil, masked villain, british actor playing american character, bar, blockbuster, bazooka, rocket launcher, costume, blindness, bridge, comic relief, snow, mountain, wisecrack humor"
Ghost Rider: Spirit of Vengeance,https://www.imdb.com/title/tt1071875/,"comicbook movie, weapon, motor vehicle, ghost rider character, vehicle, psychotronic film, part of duology, child in jeopardy, repeat sequel, stand alone sequel, superhero horror, superhero action, superhero fantasy, bmw, jeep, jeep cherokee, mercedes benz c klasse, nissan, porsche, volkswagen golf, father, mercedes benz motor vehicle, shared universe, ford motor vehicle, volkswagen motor vehicle, marvel shared universe, dark rider, supernatural fantasy, eastern europe, monk, devil, deal with the devil, hospital, fight, escape, rescue, attack, on the run, priest, motorcycle, crane, surrealism, knife throwing, tough guy, lens flare, chain, arsenal, gurney, returning from the dead, narrated by character"
Siberia,https://www.imdb.com/title/tt6494418/,"blowjob, diamond merchant, rare diamond, siberia russia, female cafe owner, extramarital affair, cunnilingus, cheating husband, neo noir, shady business deal, rough sex, intense sex, love at first sight, keeping eye contact during sex, sex in bed, female topless nudity, lover lover relationship, husband wife relationship, russian gangster, sex scene, shady business, russia, setting a house on fire, shot in the back, shot to death, german actor playing foreigner, cold weather, american, saint petersburg russia, blue diamond, woman wears a bra and panties, fellatio, death, female nudity, hunting dog, snorting cocaine, female rear nudity, diamond, american abroad, bilingualism, subtitled scene, place name in title, one word title, suspense, 2010s, ends with death of main character, death of protagonist, shot in the head, shot in the forehead, shot in the shoulder"
The Legend of Hercules,https://www.imdb.com/title/tt1043726/,"ancient greece, hercules character, greece, reference to zeus the greek deity, man tied up, chained to wall, year 1200 b.c., 12th century b.c., character repeats someone else's dialogue, sword and sandal action, husband murders his wife, 3d, 3 dimensional, europe, hercules, king, forbidden love, slavery, fight, queen, princess, prince, battle, death, wrestling with a lion, amphitheater, cheering crowd, blood sport, golden eagle, army on the march, bireme, nemean lion, rock climbing, horseback riding, chariot, kneeling before a king, fight to the death, bound in chains, hope, castle, rebellion, conspiracy, ambush, attempted murder, mercenary, statue, sword and sandal, blood, husband wife relationship, greek mythology"
Artemis Fowl,https://www.imdb.com/title/tt3089630/,"character name as title, criminal mastermind, irish, ransom, two word title, psychotronic film, kidnapping, father son relationship, mansion, actress playing male role, son looking for missing father, leprechaun, slimehouse, based on young adult novel, 3d, 3 dimensional, criminal, fairy, based on novel, character name in title"
Exposed,https://www.imdb.com/title/tt4019560/,"rape, police detective, rape victim, abusive father, traumatized woman, female protagonist, police partner, tunnel, soldier, child abuse, repressed memory, deception, death of husband, widow, little girl, nightclub, police station, birthday cake, loss of husband, funeral, dog, dead dog, dog walking, dog hit by a car, toy unicorn, toy horse, telephone call, punched in the stomach, birthday, toy, stuffed toy, nursery school, pitbull, high heels, african american, dominican, hispanic, butcher shop, butcher, webcam, levitation, waitress, broken heel, interracial romance, pregnant woman, gangster, arrest, church, subtitles, subtitled scene"
The Adventures of Rocky & Bullwinkle,https://www.imdb.com/title/tt0131704/,"live action cgi hybrid, rocky the flying squirrel character, boris badenov character, natasha fatale character, hypnosis, mass hypnosis, mind control, president, presidential election, soviet union, reference to vladimir putin, memory, memory lapse, inside a computer, the white house washington d.c., live action and animation, all star cast, cgi character in a live action movie, anthropomorphic animal, fbi federal bureau of investigation, slimehouse, live action adaptation, combined animation and live action, women wearing leather helmet and goggles, biplane, live action animation, no opening credits, slapstick comedy, narrator, president of the united states, voice over narration, road trip comedy, road trip adventure, villainess, woman wears a tie, bullwinkle j. moose character, escape, young, painted cgi, cartoon becomes a real person, cel shaded, cel shaded animation, cel shaded effect, 2000, cg animation, hand drawn animation, squirrel, moose, deforestation, lighthouse"
Yoga Hosers,https://www.imdb.com/title/tt3838992/,"yoga, disgruntled customer, female friendship, second part, playing drums, band member, knocking on a glass window in a door, yoga instructor, female gym teacher, reference to adolf hitler, high school, al pacino impression, nazi zombie, yogi, performance singing, female protagonist, rehearsal, passive aggressive woman, passive aggressive girl, arrogant woman, arrogant girl, newspaper headline, invitation to a party, mother daughter relationship, switchblade, guru, yoga guru, stepmother stepdaughter relationship, obscene hand gesture, brushing one's teeth, female gym coach, female teacher, spoiled girl, anti semitist, anti semitism, winnipeg manitoba canada, classmate classmate relationship, canadian nazi, nazism, saying the same thing simultaneously, characters say same line simultaneously, african american stereotype, reference to amanda seyfried, reference to danny trejo, self centered girl, yoga class, spiritual guru, reference to devil, threatened with a knife, satanist"
The Bye Bye Man,https://www.imdb.com/title/tt4030600/,"bare chested male, male rear nudity, hallucination, teen sex, sex scene, psychic reading, scratch mark, internet search, redacted file, hit by a car, writing on a wall, driving at night, hit with a baseball bat, claw hammer, seance, writing in a circle, shooting a hole in a door, pump action shotgun, title spoken by character, doggy style sex, maggot, female rear nudity, pornographic wallpaper, boyfriend girlfriend relationship, stabbed with scissors, shot to death, vacant house, shot through a door, gold coin, reference to casanova, cutout message, candle, startled, train 4241, naked outdoors, spectre, flickering light, drinking drain cleaner, cell phone battery dies, broken window, character name as title, the bye bye man character, four word title, supernatural power, psychotronic film, grindhouse film, gender in title, no opening credits, repetition in title, literature on screen"
Cabin Fever 2: Spring Fever,https://www.imdb.com/title/tt0961722/,"male frontal nudity, male nudity, penis, virus, spitting semen out of mouth, male rear nudity, blow job, oral sex, female topless nudity, female nudity, toilet, sex in a swimming pool, sex scene, principal, mexican, mexican stereotype, dark comedy, school, body horror, splatter horror, teen horror, prom, high school, high school prom, flesh eating virus, bottled water, male pubic hair, pubic hair, spitting, vomiting, female frontal nudity, sex with a fat woman, vomiting blood, blood splatter, reference to the columbine school shooting, hazmat suit, infection, contaminated water, blood on camera lens, bully, janitor, quarantine, shot in the head, hit on the head with a fire extinguisher, boyfriend girlfriend relationship, tooth pulling, fellatio, bare chested male, stripper, strip club"
Marmaduke,https://www.imdb.com/title/tt1392197/,"great dane, dog, rivalry, talking animal, bowl, live action cgi hybrid, animal character name as title, slimehouse, playing xbox 360, xbox 360 controller, toy dinosaur, toy jeep, family comedy, remote controlled toy truck, playstation portable, bikini, beach, playing playstation portable, toy car, family relationships, animals family, california, dog movie, beauceron dog, husky dog, dalmatian, chihuahua, bandana, afghan hound, swimming pool, labrador retriever, rain, dog in car, car, pitbull, couch, akita, siberian husky, mastiff, party, dachshund, surfing competition, surf, chinese crested dog, boss, bench, dog park, australian shepherd, bearded collie, beagle"
Are We Done Yet?,https://www.imdb.com/title/tt0422774/,"african american, pregnant woman, question in title, pop tart, moving in, pregnant wife, renovation, raccoon, los angeles lakers, reference to magic johnson, interracial friendship, african american protagonist, pickup truck, money pit, old house, little boy, fish, rooftop, widower, deer, canoe, loss of wife, campervan, mobile home, athlete, basketball player, magazine cover, magazine writer, racewalking, construction worker, construction site, cottage, buying a house, leaky roof, water leak, electric shock, power outage, chopping wood, family home, cameo, crying man, falling off a roof, breakfast, toilet, sitting on a toilet, pet dog, apartment, marital problem, home birth, telephone call"
Area 51,https://www.imdb.com/title/tt1519461/,"conspiracy, secret base, area 51, alien, security system, laboratory, climbing a fence, hiding, alien technology, military base, breaking and entering, night vision, alien abduction, friendship between men, found footage, fake documentary, no survivors, alien spacecraft, spacecraft, 2010s, united states of america, air force, u.s. air force, theory, theorist, u.s. air force soldier, conspiracy theory, conspiracy theorist, idea, notion, courage, team, team up, sketch, blueprint, death, encounter, close encounter of the third kind, fingerprint match, flying object, fingerprint data, vessel, fingerprint identification, abduction, identification, ray, lift, hover, truth, fingerprint"
Norbit,https://www.imdb.com/title/tt0477051/,"character name as title, man wears eyeglasses, woman hits a man, splash, dreamworks, car, convertible, british car, mg motor vehicle, mg car, swedish car, volvo, volvo motor vehicle, volvo car, volvo s40, u.s. car, ford, ford motor vehicle, ford car, ford f series, ford f series super duty, abuse, domestic abuse, hbo max, male nudity, male rear nudity, male wearing shorts, woman, actor plays multiple roles, marriage, orphanage, orphan, overweight, gospel music, obnoxiousness, woman played by man, urine, family conflict, forename as title, one word title, anti semitism, misogyny, buxom, cross dressing, 2000s, blooper reel, bully comeuppance, wimp turns tough, wimp, wife tries to murder husband"
Super Mario Bros.,https://www.imdb.com/title/tt0108255/,"plumber, dinosaur, italian american, based on video game, set up for unmade sequel, f rated, psychotronic film, 1990s, campy, walking into the camera, parallel dimension, orphan, megalomaniac, world domination, torture, news report, absurdism, monster, organized crime, henchman, pizza, surrealism, flamethrower, police station, mutation, gangster, restaurant, scene after end credits, mafia, super jump, sexy woman, oldies music, baseball cap, scally cap, draco reptilian, nightclub, exploding car, brooklyn new york city, dystopia, goth, cult film, car chase, action hero, action heroine, cyberpunk, nun, brother brother relationship, fungus, evolution, multiple monsters"
Inspector Gadget,https://www.imdb.com/title/tt0141369/,"villain, comic hero, hero, robocop, dog, party, hospital, bowling ball, blindfold, actor playing multiple roles, based on cartoon, based on tv series, cat, strong female character, disability, character name as title, psychotronic film, two word title, altered version of studio logo, live action adaptation, slimehouse, 1990s, cyborg, evil doppelganger, cyborg sci fi, inspector gadget character, oddjob character, jaws character, kato character, igor character, superhero action, superhero sci fi, urban adventure, police procedural crime, kids family, bumbling detective mystery, female pedal pumping, gadget, police, claw, inspector, security guard, remake, amputee, film camera, large format camera, camera, dodge viper, cartoon on tv, police inspector"
Escape Room,https://www.imdb.com/title/tt5886046/,"escape room, puzzle, teamwork, clue, code, box, evil corporation, reference to fahrenheit 451, chicago illinois, trapped under ice, parka, compass, mysterious box, glass of water, fire, key, fishing rod, cigarette lighter, billiards, survivor, oxygen mask, falling through ice, quantum zeno effect, screwdriver, reference to rudolph the red nosed reindeer, sliding puzzle, reference to one direction, eight ball, pool table, smashing a surveillence camera, defibrillator, singing in a car, flashback, falling from height, drowning, telephone, snowing, snow, magnet, poison, reference to m. c. escher, waking up from a nightmare, puzzle box, confiscating a phone, crawling through an air shaft, flask, christmas carol, climbing a tree, electrocardiogram, survival"
Highlander II: The Quickening,https://www.imdb.com/title/tt0102034/,"the future, highlander character, security checkpoint, riddled with bullets, fight on a moving vehicle, thrown from a building, thrown through a window, fight to death, decapitated head, year 2024, opera performance, future earth, corrupt company, second film in series, second in a series, return from the dead, rebellion, rebel, rebel leader, head chopped off, trial, punishment, sentence, exile, trial by combat, ultraviolet radiation, video call, zipline, control room, female scientist, control center, environmentalist, female environmentalist, hit with a bottle, run over by a train, theater performance, shakespeare play, hamlet, sex scene, speeding subway train, subway crash, year 1999, energy shield, solar radiation, taxi ride, broadsword, trans atlantic flight, airline safety video, visiting a grave, loss of wife"
Prisoners of the Ghostland,https://www.imdb.com/title/tt6372694/,"rescue, heist gone wrong, japan, geisha, exploding suit, samurai, stuck in a dream, sword fight, brothel, junkyard, radiation burn, stopped time, final battle, final showdown, governor, reference to shakespeare's sonnets, quoting shakespeare's hamlet, reference to shakespeare's sonnet 18, nightmare, ghost, kabuki, candy cinema, dystopian sci fi, one person army action, 2020s, 21st century, gumball, no opening credits, surrealism, bank robbery, bare chested male, bicycle, car crash, explosion, flashback"
Brazen,https://www.imdb.com/title/tt13978306/,"sister, investigation, murder, danger, horrifying, death, book, lawyer, neighbor, detective, novelist, sisters relationship, secret life, webcam, dominatrix, web cam model, secret room, padlocked door, teacher student relationship, sexy teacher, male student in love with female teacher, cleavage, leather outfit, woman wears a bra, red bra, white lace bra, deep cleavage, live internet feed of a murder, video taped confession, kiss, murder mystery, criminal investigation, murder investigation, private investigation, based on novel, life"
Superfast!,https://www.imdb.com/title/tt2933474/,"bare midriff, woman with a bare midriff, dancing, one word title, bomb, black light, fish, bald man, pregnancy test, robbery, nun, priest, bikini, martial arts, planning robbery, hit by a car, female female kiss, kiss, kiss on the lips, explosion, police, throwing money into the air, made fun of for being bald, giving someone herpes, man covered in baby oil, lesbian makeout, closeted lesbian, smart car, tough female cop, lesbian cop, cop criminal lesbian attraction, ethnic stereotype, herpes, lesbian, spoof, cop turns criminal, cop kills cop, street racing, heist, robbing a gangster, undercover cop, unplanned pregnancy, parody comedy, reference to grand theft auto 5, racing, tiny wrench, parody of cult film, exclamation point in title, punctuation in title, parody"
Universal Soldier: The Return,https://www.imdb.com/title/tt0176269/,"time bomb, biopunk, cyborg sci fi, jetski, planting explosives, tied to a tree, jetski chase, swamp, knife thrown in chest, research project, nudity, secret military project, electrocuted to death, firefight, knocked unconscious, scientist, military exercise, swamp boat, one person army action, female reporter, single parent, military research, television reporter, army general, gunfire, flashback, research facility, military research facility, military project, artificial intelligence, super soldier, topless nudity, brain surgery, evacuation, luc deveraux character, thrown through a window, texas, shot to death, second in series, second film in a series, microchip implant, united states of america, riddled with bullets, headbutt, female topless nudity, regeneration, sentient artificial intelligence, female journalist, tv news, female television reporter"
The Gallows,https://www.imdb.com/title/tt2309260/,"haunted school, found footage, year 1993, year 2013, high school, school play, stage, gallows, hanging, camera, talking to the camera, looking at the camera, breaking and entering, cell phone, united states of america, police, characters murdered one by one, masked murderer, supernatural horror, reference to the warriors, masked killer, october 28th, october 29th, october, autumn, supernatural serial killer, police officer, male police officer, schoolteacher, found footage horror, town with a dark secret, school, town, slasher horror, tragedy, night, fright, nebraska, set, death, friend, american horror, body count, teen horror, classmate, dark past, dark secret, secret, hanged to death, smartphone"
The Cat in the Hat,https://www.imdb.com/title/tt0312528/,"cat, talking cat, dr seuss, party, fancy party, animal urination, child, dog, mother daughter relationship, hiding under a bed, bow tie, bull, fired from a job, signing a contract, germophobe, telephone call, pet dog, animal protagonist, hat, cupcake, airbag, reference to universal studios, the beatles song, office, butt crack, the cat in the hat character, animal character name as title, handshake, telling someone to shut up, thing 2 character, thing 1 character, talking fish, goldfish, babysitter, brother sister relationship, mother, hand sanitizer, character name in title, anthropomorphic animal, anthropomorphic cat, mother son relationship, five word title, boyfriend girlfriend relationship, fishbowl, family home, asian american, taiwanese, hiding in a closet, musical number, top hat"
Bats,https://www.imdb.com/title/tt0200469/,"bat, mad scientist, mutation, evacuation, texas, mine, small town, sheriff, scientist, experiment, creature feature, animal attack, bat attack, self sacrifice, national guard, autopsy, one word title, animal as title, gore, grindhouse film, doctor, natural horror, escape, vampire bat, genetically mutated bats, mutated bats, corpse, male corpse, female corpse, bat expert, bitten by a bat, dead body, blood, alcohol consumption, alcohol, implied death of a child, implied death of an infant, cigar smoking, experiment goes wrong, bitten in the throat, skeleton, helicopter, independent film"
Thugs of Hindostan,https://www.imdb.com/title/tt5970844/,"traitor, pirate, thug, ship, british empire, east india company, british india, sea battle, betrayal, explosion, battle, sword fight, patriot, patriotism, bow and arrow, archery, british army, british raj, anti hero, flirting, based on novel"
They/Them,https://www.imdb.com/title/tt14502344/,"psychological thriller, male rear nudity, gay conversion camp, gay conversion therapy, gay conversion, homosexuality, gay, psychological horror, slasher, oral sex, lesbian sex, bare chested male, female rear nudity, lgbtqia, lesbian, male nudity, teenager, female nudity, slasher horror, non binary, group, aversion therapy, behavior modification, group therapy, camp, queer horror, lgbt horror, transgender woman, transgender"
Speed 2: Cruise Control,https://www.imdb.com/title/tt0120179/,"cruise ship, sign language, ship, collision course, bomb, teenage girl, hand grenade, surprise during end credits, motorcycle cop, police chase, near death experience, driving test, ship run aground, number in title, repeat sequel, time bomb, vomiting, caribbean sea, waterborne ship, nipples visible through clothing, cleavage, sexy woman, no underwear, no panties, child in jeopardy, downblouse, braless, four word title, numbered sequel, colon in title, vacation gone wrong, character repeats someone else's dialogue, barefoot, oily skin, sweating, barefoot woman, kiss, bikini, band, singing, deaf, deaf girl, underwater, female pedal pumping, passenger, diamond, porter, oil tanker, danger, computer hacker"
One Missed Call,https://www.imdb.com/title/tt0479968/,"telephone terror, supernatural horror, message from beyond the grave, phone call from beyond the grave, warning from beyond the grave, mystery from beyond the grave, grindhouse film, child in jeopardy, choking to death, death, voice mail, lifting someone into the air, telephone, telephone call, telephone call from self, teddy bear, supernatural power, screaming, murder, montage, flashback, chase, horror movie remake, title appears in writing, tv show, television producer, stabbed in the eye, spirit, sister sister relationship, severed hand, pond, police station, police officer killed, police detective, phone video, peephole, party, nanny cam, mysterious death, mother daughter relationship, library, knife, killer child, investigation, insect, impalement, hospital, hit by a train, hidden camera, hanged man"
The Guardians,https://www.imdb.com/title/tt4600952/,"russia, villain, superhero team, supernatural power, non comic book superhero, murder, russian superhero, russian science fiction, european science fiction, superhero fantasy, superhero action, superhero sci fi, team action, patriot, bare chested male, death, technology, destruction, power, violence, bear, superhero"
The Adventures of Pluto Nash,https://www.imdb.com/title/tt0180052/,"the future, african american hero, gangster, breasts growing, violence, nightclub shootout, laser pistol, chase, vehicle, slimehouse, scene during opening credits, 2080s, year 2087, earth's moon, 21st century, man, space sci fi, moon, casino, nightclub, future, laser gun, gunfight, shootout, african american, outer space, posing as married couple, posing as husband and wife, falling from height, explosion, bodyguard, robot, clone, singer, twins, mars the planet, crude humor, cloning, nightclub owner, on the run, falling from a window, character name in title, surprise ending"
London Fields,https://www.imdb.com/title/tt1273221/,"dystopia, guy fawkes day, male writer, based on novel, neo noir, writer's block, american in london, cheating husband, terminal illness, three men one woman love fourangle, female nudity, female rear nudity, death, love, fatal attraction, sex with multiple partners, clairvoyant woman, female full rear nudity"
The Disappointments Room,https://www.imdb.com/title/tt2364897/,"cat, blood, pulled from theater, supernatural serial killer, child in jeopardy, husband wife relationship, attic, baby, key, death, pills, dog, woman in jeopardy, wine, photograph, kitchen, beating, dead body, f word, drinking, young woman, suspense, mysterious, door lock, little girl, little boy, secret room, ghost, fear, broken mirror, flashback, blonde"
